{"alchemist_ir_version":"0.1.0","metadata":{"name":"Extensions"},"inputs":[],"outputs":[],"variables":{},"secrets":[],"nodes":[{"id":"x","kind":"custom","config":{},"inputs":[],"outputs":[],"metadata":{},"extensions":{"n8n":{"type":"community.special","typeVersion":2},"langflow":{"component":"Special"}}}],"edges":[],"extensions":{"n8n":{"settings":{"executionOrder":"v1"}},"langflow":{"description":"preserved"}}}
