{"alchemist_ir_version":"0.1.0","metadata":{"name":"Condition"},"inputs":[],"outputs":[],"variables":{},"secrets":[],"nodes":[{"id":"in","kind":"input","config":{},"inputs":[],"outputs":[],"metadata":{}},{"id":"check","kind":"condition","config":{"expression":"enabled"},"inputs":[],"outputs":[],"metadata":{}},{"id":"out","kind":"output","config":{},"inputs":[],"outputs":[],"metadata":{}}],"edges":[{"from":"in","to":"check"},{"from":"check","to":"out","condition":{"equals":true}}],"extensions":{}}
