{"alchemist_ir_version":"0.1.0","metadata":{"name":"LLM with tool"},"inputs":[],"outputs":[],"variables":{"temperature":0},"secrets":[{"name":"openai","reference":"env:OPENAI_API_KEY"}],"nodes":[{"id":"prompt","kind":"prompt","config":{"template":"Answer: {{question}}"},"inputs":[],"outputs":[],"metadata":{}},{"id":"model","kind":"llm","config":{"model":"gpt-4.1-mini"},"inputs":[],"outputs":[],"metadata":{}},{"id":"search","kind":"tool","config":{"operation":"search"},"inputs":[],"outputs":[],"metadata":{}}],"edges":[{"from":"prompt","to":"model"},{"from":"search","to":"model","mapping":{"target_port":"tools"}}],"extensions":{}}
