{"alchemist_ir_version":"0.1.0","metadata":{"name":"Branching condition"},"inputs":[],"outputs":[],"variables":{},"secrets":[],"nodes":[{"id":"in","kind":"input","config":{},"inputs":[],"outputs":[],"metadata":{}},{"id":"if","kind":"condition","config":{"expression":"score > 0.5"},"inputs":[],"outputs":[],"metadata":{}},{"id":"yes","kind":"output","config":{},"inputs":[],"outputs":[],"metadata":{}},{"id":"no","kind":"output","config":{},"inputs":[],"outputs":[],"metadata":{}}],"edges":[{"from":"in","to":"if"},{"from":"if","to":"yes","condition":{"branch":"true"}},{"from":"if","to":"no","condition":{"branch":"false"}}],"extensions":{}}
