{"alchemist_ir_version":"0.1.0","metadata":{"name":"LLM"},"inputs":[],"outputs":[],"variables":{"temperature":0},"secrets":[{"name":"provider","reference":"env:MODEL_API_KEY"}],"nodes":[{"id":"prompt","kind":"prompt","config":{"template":"Answer {{question}}"},"inputs":[],"outputs":[],"metadata":{}},{"id":"model","kind":"llm","config":{"model":"provider-model"},"inputs":[],"outputs":[],"metadata":{}}],"edges":[{"from":"prompt","to":"model"}],"extensions":{}}
