{"alchemist_ir_version":"0.1.0","metadata":{"name":"Tool"},"inputs":[],"outputs":[],"variables":{},"secrets":[],"nodes":[{"id":"in","kind":"input","config":{},"inputs":[],"outputs":[],"metadata":{}},{"id":"request","kind":"tool","config":{"operation":"http_request","url":"https://example.com"},"inputs":[],"outputs":[],"metadata":{}}],"edges":[{"from":"in","to":"request"}],"extensions":{}}
